{
  "schema_version": "1.0",
  "target": {
    "target_id": "new_target",
    "target_name": "New target compound",
    "formula": null,
    "charge_state_in_model": null,
    "compartment": "p",
    "synonyms": []
  },
  "compounds": [
    {
      "compound_id": "target_cpd",
      "name": "New target compound",
      "role": "target",
      "formula": null,
      "charge": null,
      "smiles": null,
      "smiles_source": "unresolved",
      "model_metabolite_id": "cand_target_p"
    }
  ],
  "candidate_reactions": [],
  "routes": [],
  "enzyme_search": {
    "enzyme_classes": [],
    "exact_terms": [],
    "near_terms": [],
    "external_sources": ["UniProt", "Rhea", "PubMed"],
    "tiering_policy": "default_A_exact_reaction_to_E_keyword"
  },
  "prediction_pairs": [],
  "external_evidence": {
    "input_paths": []
  },
  "engineering_layers": {
    "family_sanity_filter": {
      "enabled": true,
      "preferred_families": [],
      "weak_family_patterns": []
    },
    "specialized_feasibility_layers": [],
    "feasibility_rules": [],
    "construct_design": {
      "enabled": false,
      "design_scope": "prioritization checklist only; not wet-lab protocol"
    }
  }
}
